{
  "$schema": "https://json-schema.org/draft/2020-12/schema",
  "$id": "graphpilot.delivery.live-anchor-approval.v1",
  "title": "GraphPilot Block 5 Live Anchor Product-Owner Approval v1",
  "type": "object",
  "additionalProperties": false,
  "required": ["schemaVersion", "kind", "approvalId", "packageId", "anchorDigest", "decision", "reviewer", "reviewedAt", "sections", "attestations", "overallNotes", "digest"],
  "properties": {
    "schemaVersion": {"const": "graphpilot.delivery.live-anchor-approval.v1"},
    "kind": {"const": "liveAnchorApproval"},
    "approvalId": {"type": "string", "pattern": "^approval-live-anchor-cold-room-[a-z0-9]+(?:-[a-z0-9]+)*$", "maxLength": 160},
    "packageId": {"const": "package-live-anchor-cold-room-climate-controller-20260728-01"},
    "anchorDigest": {"const": "sha256:12a4528c6d717bba44d7408a78bb7f1723d0c53a55261984a252eba6f553b51b"},
    "decision": {"enum": ["approve", "revise"]},
    "reviewer": {
      "type": "object",
      "additionalProperties": false,
      "required": ["kind", "id", "attestation"],
      "properties": {
        "kind": {"const": "product_owner"},
        "id": {"type": "string", "pattern": "^product-owner-[a-z0-9]+(?:-[a-z0-9]+)*$", "maxLength": 128},
        "attestation": {"const": "I am the human product owner making this decision; no agent made it for me."}
      }
    },
    "reviewedAt": {"type": "string", "format": "date-time", "pattern": "Z$", "maxLength": 32},
    "sections": {
      "type": "object",
      "additionalProperties": false,
      "required": ["identity", "readiness", "requiredMeaning", "forbiddenMeaning", "delivery", "liveSchedule", "scope"],
      "properties": {
        "identity": {"$ref": "#/$defs/section"},
        "readiness": {"$ref": "#/$defs/section"},
        "requiredMeaning": {"$ref": "#/$defs/section"},
        "forbiddenMeaning": {"$ref": "#/$defs/section"},
        "delivery": {"$ref": "#/$defs/section"},
        "liveSchedule": {"$ref": "#/$defs/section"},
        "scope": {"$ref": "#/$defs/section"}
      }
    },
    "attestations": {
      "type": "object",
      "additionalProperties": false,
      "required": ["humanReview", "agentReviewExcluded", "notCalibrationOrCertification", "checklistExcludedFromProvider", "liveBudgetAccepted"],
      "properties": {
        "humanReview": {"type": "boolean"},
        "agentReviewExcluded": {"type": "boolean"},
        "notCalibrationOrCertification": {"type": "boolean"},
        "checklistExcludedFromProvider": {"type": "boolean"},
        "liveBudgetAccepted": {"type": "boolean"}
      }
    },
    "overallNotes": {"type": "string", "maxLength": 4000},
    "digest": {"type": "string", "pattern": "^sha256:[0-9a-f]{64}$"}
  },
  "$defs": {
    "section": {
      "type": "object",
      "additionalProperties": false,
      "required": ["decision", "notes"],
      "properties": {
        "decision": {"enum": ["approve", "revise"]},
        "notes": {"type": "string", "maxLength": 2000}
      }
    }
  },
  "allOf": [
    {
      "if": {"properties": {"decision": {"const": "approve"}}, "required": ["decision"]},
      "then": {
        "properties": {
          "sections": {
            "properties": {
              "identity": {"properties": {"decision": {"const": "approve"}}},
              "readiness": {"properties": {"decision": {"const": "approve"}}},
              "requiredMeaning": {"properties": {"decision": {"const": "approve"}}},
              "forbiddenMeaning": {"properties": {"decision": {"const": "approve"}}},
              "delivery": {"properties": {"decision": {"const": "approve"}}},
              "liveSchedule": {"properties": {"decision": {"const": "approve"}}},
              "scope": {"properties": {"decision": {"const": "approve"}}}
            }
          },
          "attestations": {
            "properties": {
              "humanReview": {"const": true},
              "agentReviewExcluded": {"const": true},
              "notCalibrationOrCertification": {"const": true},
              "checklistExcludedFromProvider": {"const": true},
              "liveBudgetAccepted": {"const": true}
            }
          }
        }
      }
    }
  ]
}
